{
  "$schema": "../../project-hawaii/playground/hawaii.draft-01.schema.json",
  "data-source": {
    "database-type": "mssql",
    "connection-string": ""
  },
  "mssql": {
    "set-session-context": true
  },
  "runtime": {
    "rest": {
      "enabled": true,
      "path": "/api"
    },
    "graphql": {
      "enabled": true,
      "path": "/graphql",
      "allow-introspection": true
    },
    "host": {
      "cors": {
        "origins": [ "1", "2" ],
        "allow-credentials": true
      },
      "authentication": {
        "provider": "",
        "jwt": {
          "audience": "",
          "authority": "",
          "issuer": "",
          "issuer-key": ""
        }
      }
    }
  },
  "entities": {
    "publishers": {
      "source": "dbo.publishers",
      "rest": true,
      "graphql": true,
      "permissions": [
        {
          "role": "anonymous",
          "actions": [ "read" ]
        },
        {
          "role": "authenticated",
          "actions": [ "create", "read", "update", "delete" ]
        }
      ],
      "relationships": {
        "books": {
          "cardinality": "many",
          "target.entity": "books"
        }
      }
    },
    "stocks": {
      "source": "dbo.stocks",
      "rest": true,
      "graphql": true,
      "permissions": [
        {
          "role": "anonymous",
          "actions": [ "read" ]
        },
        {
          "role": "authenticated",
          "actions": [ "create", "read", "update" ]
        }
      ],
      "relationships": {
        "comics": {
          "cardinality": "many",
          "target.entity": "comics"
        }
      }
    },
    "books": {
      "source": "dbo.books",
      "permissions": [
        {
          "role": "anonymous",
          "actions": [ "read" ]
        },
        {
          "role": "authenticated",
          "actions": [ "create", "update", "delete" ]
        }
      ],
      "relationships": {
        "publisher": {
          "cardinality": "one",
          "target.entity": "publisher"
        },
        "websiteplacement": {
          "cardinality": "one",
          "target.entity": "book_website_placements"
        },
        "reviews": {
          "cardinality": "many",
          "target.entity": "reviews"
        },
        "authors": {
          "cardinality": "many",
          "target.entity": "authors",
          "linking.object": "book_author_link"
        }
      }
    },
    "book_website_placements": {
      "source": "dbo.book_website_placements",
      "rest": true,
      "graphql": true,
      "permissions": [
        {
          "role": "anonymous",
          "actions": [ "read" ]
        },
        {
          "role": "authenticated",
          "actions": [ "create", "update", "delete" ]
        }
      ],
      "relationships": {
        "book_website_placements": {
          "cardinality": "one",
          "target.entity": "books"
        }
      }
    },
    "authors": {
      "source": "dbo.authors",
      "rest": true,
      "graphql": true,
      "permissions": [
        {
          "role": "anonymous",
          "actions": [ "read" ]
        }
      ],
      "relationships": {
        "books": {
          "cardinality": "many",
          "target.entity": "books",
          "linking.object": "book_author_link"
        }
      }
    },
    "reviews": {
      "source": "dbo.reviews",
      "rest": true,
      "permissions": [
        {
          "role": "anonymous",
          "actions": [ "read" ]
        }
      ],
      "relationships": {
        "books": {
          "cardinality": "one",
          "target.entity": "books"
        }
      }
    },
    "magazines": {
      "source": "dbo.magazines",
      "graphql": true,
      "permissions": [
        {
          "role": "anonymous",
          "actions": [ "read" ]
        },
        {
          "role": "authenticated",
          "actions": [ "create", "read", "update", "delete" ]
        }
      ]
    },
    "comics": {
      "source": "dbo.comics",
      "rest": true,
      "graphql": false,
      "permissions": [
        {
          "role": "anonymous",
          "actions": [ "read" ]
        },
        {
          "role": "authenticated",
          "actions": [ "create", "read", "delete" ]
        }
      ]
    },
    "brokers": {
      "source": "dbo.brokers",
      "graphql": false,
      "permissions": [
        {
          "role": "anonymous",
          "actions": [ "read" ]
        }
      ]
    }
  }
}
